"Name";"AdmArea";"District";"Address";"FacilityArea";"PeriodOfPlacement";"ContractStatus";"ContractNumber";"NameOfBusinessEntity";"BeginDate";"EndDate";"CertificateNum";"CertificateIssueDate";"PrefectOrderNumber";"PrefectOrderDate";"UNOM";"PlacementAtStationaryObjects";"global_id";"geoData";"geodata_center";
"Елочный базар на б-р Яна Райниса, вл. 29";"Северо-Западный административный округ";"район Южное Тушино";"Российская Федерация, город Москва, внутригородская территория муниципальный округ Южное Тушино, бульвар Яна Райниса, дом 29";"20";"с 20 декабря по 31 декабря";"действующий";"НТО-02-05-008259";"ИМПЕКС";"19.10.2021";"19.10.2026";"";"19.10.2021";"";"";"21580";"нет";"2716691267";"{coordinates=[37.422151, 55.848734], type=Point}";"";
"Елочный базар на ул. Кашенкин луг, 6, к. 3";"Северо-Восточный административный округ";"район Марфино";"Российская Федерация, город Москва, внутригородская территория муниципальный округ Марфино, улица Кашёнкин Луг, дом 6, корпус 3";"20";"с 20 декабря по 31 декабря";"действующий";"НТО-02-05-007260";"БОГДАНОВА ЕЛЕНА ЛЕОНИДОВНА";"13.11.2020";"13.11.2025";"";"13.11.2020";"";"";"230449";"нет";"2716691268";"{coordinates=[37.598178, 55.825917], type=Point}";"";
"Елочный базар на ул.Шаболовка, вл.26-28";"Центральный административный округ";"район Якиманка";"город Москва, улица Шаболовка, дом 26, строение 1";"12";"с 20 декабря по 31 декабря";"действующий";"НТО-02-05-008765";"БОГДАНОВА ЕЛЕНА ЛЕОНИДОВНА";"11.08.2022";"11.08.2027";"";"11.08.2022";"";"";"4300221";"нет";"2716691269";"{coordinates=[37.60946, 55.720453], type=Point}";"";
"Елочный базар на проспект Мира, 120";"Северо-Восточный административный округ";"Алексеевский район";"Российская Федерация, город Москва, внутригородская территория муниципальный округ Алексеевский, проспект Мира, дом 120";"30";"с 20 декабря по 31 декабря";"действующий";"НТО-02-05-007259";"БОГДАНОВА ЕЛЕНА ЛЕОНИДОВНА";"13.11.2020";"13.11.2025";"";"13.11.2020";"";"";"14526";"нет";"2716691270";"{coordinates=[37.63861, 55.811393], type=Point}";"";
"Елочный базар на ул. Бочкова, вл. 3";"Северо-Восточный административный округ";"Останкинский район";"Российская Федерация, город Москва, внутригородская территория муниципальный округ Останкинский, улица Бочкова, дом 3";"30";"с 20 декабря по 31 декабря";"действующий";"НТО-02-05-008370";"БОГДАНОВА ЕЛЕНА ЛЕОНИДОВНА";"09.11.2021";"09.11.2026";"";"09.11.2021";"";"";"2740";"нет";"2716691271";"{coordinates=[37.635494, 55.810066], type=Point}";"";
"Ели, сосны, лапник на Коптевская, д. 8";"Северный административный округ";"район Коптево";"Российская Федерация, город Москва, внутригородская территория муниципальный округ Коптево, Коптевская улица, дом 8";"20";"с 20 декабря по 31 декабря";"действующий";"НТО-02-05-007572";"БОГДАНОВА ЕЛЕНА ЛЕОНИДОВНА";"19.02.2021";"19.02.2026";"";"19.02.2021";"";"";"10849";"нет";"2716691272";"{coordinates=[37.517303, 55.827036], type=Point}";"";
"Елочный базар на Ленинградский пр., вл. 74, к. 6";"Северный административный округ";"район Аэропорт";"Российская Федерация, город Москва, внутригородская территория муниципальный округ Аэропорт, Ленинградский проспект, дом 74, корпус 6";"15";"с 20 декабря по 31 декабря";"действующий";"НТО-02-05-007600";"БОГДАНОВА ЕЛЕНА ЛЕОНИДОВНА";"10.03.2021";"10.03.2026";"";"11.03.2021";"";"";"12703";"нет";"2716691273";"{coordinates=[37.516302, 55.806283], type=Point}";"";
"Елочный базар на поселение Рязановское, п. Знамя Октября, вблизи д. 31с1";"Новомосковский административный округ";"поселение Рязановское";"Российская Федерация, город Москва, внутригородская территория поселение Рязановское, посёлок Знамя Октября, дом 31, строение 3";"15";"с 20 декабря по 31 декабря";"действующий";"НТО-02-05-009944";"РУССКОЕ ПОЛЕ";"02.05.2024";"02.05.2029";"";"02.05.2024";"";"";"4401801";"нет";"2716691274";"{coordinates=[37.54298, 55.472784], type=Point}";"";
"Ели, сосны, лапник на Ломоносовский пр-т, 14-18";"Юго-Западный административный округ";"Гагаринский район";"Российская Федерация, город Москва, внутригородская территория муниципальный округ Гагаринский, Ломоносовский проспект, дом 14";"20";"с 20 декабря по 31 декабря";"действующий";"НТО-02-05-007237";"АЛИЕВ АЛИМАМЕД ШАБАН ОГЛЫ";"10.11.2020";"10.11.2025";"";"10.11.2020";"";"";"13386";"нет";"2716691275";"{coordinates=[37.540931, 55.691484], type=Point}";"";
"Ели, сосны, лапник на Симферопольский бульвар, вл. 25";"Южный административный округ";"Нагорный район";"Российская Федерация, город Москва, внутригородская территория муниципальный округ Нагорный, Симферопольский бульвар, владение 25А";"24";"с 20 декабря по 31 декабря";"действующий";"НТО-02-05-007360";"АЛИЕВ АЛИМАМЕД ШАБАН ОГЛЫ";"15.12.2020";"15.12.2025";"";"15.12.2020";"";"";"3802325";"нет";"2716691276";"{coordinates=[37.605793402, 55.649171304], type=Point}";"";
"Ели, сосны, лапник на ул. Ремизова, вл.15";"Юго-Западный административный округ";"район Котловка";"Российская Федерация, город Москва, внутригородская территория муниципальный округ Котловка, улица Ремизова, дом 15, корпус 1";"30";"с 20 декабря по 31 декабря";"действующий";"НТО-02-05-007620";"ОГАНЕСЯН САМВЕЛ ДАНИЛОВИЧ";"29.03.2021";"29.03.2026";"";"29.03.2021";"";"";"21750";"нет";"2716691277";"{coordinates=[37.604664, 55.674892], type=Point}";"";
"Елочный базар на Севастопольский проспект, вл. 3Б";"Южный административный округ";"Донской район";"Российская Федерация, город Москва, внутригородская территория муниципальный округ Донской, Севастопольский проспект, дом 3Б";"15";"с 20 декабря по 31 декабря";"действующий";"НТО-02-05-007934";"ОГАНЕСЯН САМВЕЛ ДАНИЛОВИЧ";"03.08.2021";"03.08.2026";"";"03.08.2021";"";"";"2107500";"нет";"2716691278";"{coordinates=[37.609081864, 55.692965126], type=Point}";"";
"Елочный базар на ул. Юных Ленинцев, 12";"Юго-Восточный административный округ";"район Текстильщики";"Российская Федерация, город Москва, внутригородская территория муниципальный округ Текстильщики, улица Юных Ленинцев, дом 12";"24";"с 20 декабря по 31 декабря";"действующий";"НТО-02-05-008469";"ОГАНЕСЯН САМВЕЛ ДАНИЛОВИЧ";"09.12.2021";"09.12.2026";"";"02.12.2021";"";"";"2129788";"нет";"2716691279";"{coordinates=[37.740138, 55.699502], type=Point}";"";
"Ели, сосны, лапник на Мичуринский просп., д.36";"Западный административный округ";"район Раменки";"Российская Федерация, город Москва, внутригородская территория муниципальный округ Раменки, Мичуринский проспект, дом 36";"15";"с 20 декабря по 31 декабря";"действующий";"НТО-02-05-008467";"ОГАНЕСЯН САМВЕЛ ДАНИЛОВИЧ";"01.12.2021";"01.12.2026";"";"01.12.2021";"";"";"2116821";"нет";"2716691280";"{coordinates=[37.497798, 55.697644], type=Point}";"";
